[
  {
    "id": 1,
    "slug": "question-1",
    "locale": "fr",
    "title": "Quelle est la sortie ?",
    "promptMarkdown": "```javascript\nfunction sayHi() {\n  console.log(name);\n  console.log(age);\n  var name = \"Lydia\";\n  let age = 21;\n}\n\nsayHi();\n```",
    "codeBlocks": [
      {
        "id": "code-1",
        "order": 0,
        "language": "javascript",
        "code": "function sayHi() {\n  console.log(name);\n  console.log(age);\n  var name = \"Lydia\";\n  let age = 21;\n}\n\nsayHi();"
      }
    ],
    "explanationCodeBlocks": [],
    "options": [
      {
        "key": "A",
        "text": "`Lydia` et `undefined`"
      },
      {
        "key": "B",
        "text": "`Lydia` et `ReferenceError`"
      },
      {
        "key": "C",
        "text": "`ReferenceError` et `21`"
      },
      {
        "key": "D",
        "text": "`undefined` et `ReferenceError`"
      }
    ],
    "correctOption": "D",
    "explanationMarkdown": "Dans la fonction, nous déclarons en premier la variable `name` grâce au mot clé `var`. Cela signifie que la variable est \"levée\" _(hoisted)_ (l'espace mémoire est définie à la phase de création) avec pour valeur par défaut `undefined`, jusqu'à ce que le script atteigne la ligne de définition de la variable. Nous n'avons pas encore défini la variable lorsque nous essayons d'afficher la variable `name`, donc elle a toujours la valeur `undefined`.\n\nLes variables avec le mot clé `let` (et `const`) sont \"levées\" _(hoisted)_, mais contrairement à `var`, elle n'est pas <i>initialisée</i>. Elles ne sont pas accessible avant la ligne qui les déclare (initialise). C'est appelé la \"zone morte temporaire\". Lorsque nous essayons d'accéder aux variables avant leur déclaration, JavaScript renvoie une `ReferenceError`.",
    "images": [],
    "tags": [
      "scope",
      "objects",
      "types"
    ],
    "difficulty": "beginner",
    "runnable": true,
    "runtime": {
      "kind": "javascript"
    },
    "source": {
      "startLineHint": null
    }
  },
  {
    "id": 2,
    "slug": "question-2",
    "locale": "fr",
    "title": "Quelle est la sortie ?",
    "promptMarkdown": "```javascript\nfor (var i = 0; i < 3; i++) {\n  setTimeout(() => console.log(i), 1);\n}\n\nfor (let i = 0; i < 3; i++) {\n  setTimeout(() => console.log(i), 1);\n}\n```",
    "codeBlocks": [
      {
        "id": "code-1",
        "order": 0,
        "language": "javascript",
        "code": "for (var i = 0; i < 3; i++) {\n  setTimeout(() => console.log(i), 1);\n}\n\nfor (let i = 0; i < 3; i++) {\n  setTimeout(() => console.log(i), 1);\n}"
      }
    ],
    "explanationCodeBlocks": [],
    "options": [
      {
        "key": "A",
        "text": "`0 1 2` et `0 1 2`"
      },
      {
        "key": "B",
        "text": "`0 1 2` et `3 3 3`"
      },
      {
        "key": "C",
        "text": "`3 3 3` et `0 1 2`"
      }
    ],
    "correctOption": "C",
    "explanationMarkdown": "À cause du système de queue dans JavaScript, la fonction de rappel _(callback)_ du `setTimeout` est appelée _après_ que la boucle soit exécutée. Comme la variable `i` dans la première boucle est déclarée avec le mot-clé `var`, c'est une variable globale. Pendant la boucle, nous incrémentons la valeur de `i` de `1` à chaque fois, en utilisant l'opérateur arithmétique `++`. Lorsque la fonction de rappel _(callback)_ du `setTimeout` est invoquée, `i` est égal à `3` dans le premier exemple.\n\nDans la seconde boucle, la variable `i` est déclarée avec le mot clé `let` : les variables déclarées avec `let` (et `const`) ont une portée de bloc (tout ce qui est entre `{ }` est considéré comme un bloc). Pendant chaque itération, `i` aura une nouvelle valeur, et chaque valeur sera définie dans la boucle.",
    "images": [],
    "tags": [
      "async"
    ],
    "difficulty": "beginner",
    "runnable": true,
    "runtime": {
      "kind": "javascript"
    },
    "source": {
      "startLineHint": null
    }
  },
  {
    "id": 3,
    "slug": "question-3",
    "locale": "fr",
    "title": "Quelle est la sortie ?",
    "promptMarkdown": "```javascript\nconst shape = {\n  radius: 10,\n  diameter() {\n    return this.radius * 2;\n  },\n  perimeter: () => 2 * Math.PI * this.radius\n};\n\nshape.diameter();\nshape.perimeter();\n```",
    "codeBlocks": [
      {
        "id": "code-1",
        "order": 0,
        "language": "javascript",
        "code": "const shape = {\n  radius: 10,\n  diameter() {\n    return this.radius * 2;\n  },\n  perimeter: () => 2 * Math.PI * this.radius\n};\n\nshape.diameter();\nshape.perimeter();"
      }
    ],
    "explanationCodeBlocks": [],
    "options": [
      {
        "key": "A",
        "text": "`20` et `62.83185307179586`"
      },
      {
        "key": "B",
        "text": "`20` et `NaN`"
      },
      {
        "key": "C",
        "text": "`20` et `63`"
      },
      {
        "key": "D",
        "text": "`NaN` et `63`"
      }
    ],
    "correctOption": "B",
    "explanationMarkdown": "Notez que la valeur de `diameter` est une fonction régulière, alors que celle de `perimeter` est une fonction fléchée.\n\nAvec les fonctions fléchée, le mot clé `this` réfère à son périmètre actuel, contrairement aux fonctions régulières ! Cela signifie que lorsque nous appelons `perimeter`, elle ne réfère pas à l'objet `shape`, mais à son périmètre actuel (`window` par exemple).\n\nIl n'y a pas de valeur `radius` dans cet objet, on retournera `undefined`.",
    "images": [],
    "tags": [
      "types",
      "dom-events"
    ],
    "difficulty": "beginner",
    "runnable": true,
    "runtime": {
      "kind": "javascript"
    },
    "source": {
      "startLineHint": null
    }
  },
  {
    "id": 4,
    "slug": "question-4",
    "locale": "fr",
    "title": "Quelle est la sortie ?",
    "promptMarkdown": "```javascript\n+true;\n!\"Lydia\";\n```",
    "codeBlocks": [
      {
        "id": "code-1",
        "order": 0,
        "language": "javascript",
        "code": "+true;\n!\"Lydia\";"
      }
    ],
    "explanationCodeBlocks": [],
    "options": [
      {
        "key": "A",
        "text": "`1` et `false`"
      },
      {
        "key": "B",
        "text": "`false` et `NaN`"
      },
      {
        "key": "C",
        "text": "`false` et `false`"
      }
    ],
    "correctOption": "A",
    "explanationMarkdown": "L'opérateur arithmétique `+` essait de convertir un opérande en une valeur numérique. `true` devient `1`, et `false` devient `0`.\n\nLa chaîne de caractère `'Lydia'` est une valeur considérée comme vraie _(truthy)_. Ce que nous sommes actuellement en train de demander, c'est \"est-ce que cette valeur considérée comme vraie est fausse ?\". Ce qui retournera `false`.",
    "images": [],
    "tags": [
      "types"
    ],
    "difficulty": "beginner",
    "runnable": true,
    "runtime": {
      "kind": "javascript"
    },
    "source": {
      "startLineHint": null
    }
  },
  {
    "id": 5,
    "slug": "question-5",
    "locale": "fr",
    "title": "Laquelle est vraie ?",
    "promptMarkdown": "```javascript\nconst bird = {\n  size: \"small\"\n};\n\nconst mouse = {\n  name: \"Mickey\",\n  small: true\n};\n```",
    "codeBlocks": [
      {
        "id": "code-1",
        "order": 0,
        "language": "javascript",
        "code": "const bird = {\n  size: \"small\"\n};\n\nconst mouse = {\n  name: \"Mickey\",\n  small: true\n};"
      }
    ],
    "explanationCodeBlocks": [],
    "options": [
      {
        "key": "A",
        "text": "`mouse.bird.size` n'est pas valide"
      },
      {
        "key": "B",
        "text": "`mouse[bird.size]` n'est pas valide"
      },
      {
        "key": "C",
        "text": "`mouse[bird[\"size\"]]` n'est pas valide"
      },
      {
        "key": "D",
        "text": "Toutes sont valides"
      }
    ],
    "correctOption": "A",
    "explanationMarkdown": "En JavaScript, toutes les clés d'objet sont des chaînes de caractères (sauf si c'est un Symbol). Bien que nous ne puissions pas les _typer_ comme des chaînes de caractères, elles sont converties en chaînes de caractères sous le capot.\n\nJavaScript interprète (ou décompresse) les instructions. Lorsque nous utilisons la notation par crochet, il voit le premier crochet `[` et continue jusqu'à ce qu'il trouve le crochet fermant `]`. Seulement après, il évalue l'instruction.\n\n`mouse[bird.size]` : Premièrement, il évalue `bird.size`, qui est `\"small\"`. `mouse[\"small\"]` retourne `true`.\n\nCependant, avec la notation par points, cela n'arrive pas. `mouse` n'a pas de clé appelée `bird`, ce qui signifie que `mouse.bird` est `undefined`. Puis, on demande `size` en utilisant la notation par point : `mouse.bird.size`. Comme `mouse.bird` est `undefined`, on demande `undefined.size`. Cela n'est pas valide, et nous aurons une erreur similaire à `Impossible de lire la propriété \"size\" de undefined`.",
    "images": [],
    "tags": [
      "types"
    ],
    "difficulty": "beginner",
    "runnable": true,
    "runtime": {
      "kind": "javascript"
    },
    "source": {
      "startLineHint": null
    }
  },
  {
    "id": 6,
    "slug": "question-6",
    "locale": "fr",
    "title": "Quelle est la sortie ?",
    "promptMarkdown": "```javascript\nlet c = { greeting: \"Hey!\" };\nlet d;\n\nd = c;\nc.greeting = \"Hello\";\nconsole.log(d.greeting);\n```\n\n\n\n\n\n- E: `TypeError`",
    "codeBlocks": [
      {
        "id": "code-1",
        "order": 0,
        "language": "javascript",
        "code": "let c = { greeting: \"Hey!\" };\nlet d;\n\nd = c;\nc.greeting = \"Hello\";\nconsole.log(d.greeting);"
      }
    ],
    "explanationCodeBlocks": [],
    "options": [
      {
        "key": "A",
        "text": "`Hello`"
      },
      {
        "key": "B",
        "text": "`Hey`"
      },
      {
        "key": "C",
        "text": "`undefined`"
      },
      {
        "key": "D",
        "text": "`ReferenceError`"
      }
    ],
    "correctOption": "A",